{
  "schema": "meowy.distribution",
  "version": 1,
  "release": "0.0.1+schema-example",
  "target": "x86_64-unknown-linux-gnu",
  "cpu_features": ["x86-64", "sse2"],
  "minimum_kernel": "5.4",
  "minimum_glibc": "2.31",
  "link_modes": ["platform", "shared", "static"],
  "lto_modes": ["off", "thin", "full"],
  "debug_modes": ["embedded", "separate", "none"],
  "inventory": []
}
